{
  "schema_version": "1.0.0",
  "run_id": "f4231e08-419b-4df6-a790-054130cbb50c",
  "fixture_id": "R2B-191-D",
  "status": "INCONCLUSIVE",
  "reason": "DRY_RUN_NO_IMAGES",
  "delta_sha256": "6159ef5f5666afb9037f5ba9512cf6a3d3c89a778f376961c9c570391ce59282",
  "images": [],
  "technical_failures": [],
  "visual_verdict": "INDETERMINATE",
  "seed_controlled": false
}
